Agency,Account,State,Recipient,Project, Amount ,Requested by,Requested by 2
Department of Justice,COPS Tech,HI,Honolulu Police Department,Emergency Mobile Command Vehicle,"$1,000,000 ",Case,
Department of Justice,COPS Tech, TX,"Bexar County, Texas",Bexar County Emergency Communications Radio Replacement,"$1,031,000 ",Castro,
Department of Justice,COPS Tech, FL,City of Sunrise/Sunrise Police Department,City of Sunrise Regional Park Safety and Security Enhancements,"$1,031,000 ",Cherfilus-McCormick,
Department of Justice,COPS Tech, CA,City of Pasadena,Regional Public Safety Communications Upgrade Pasadena Prime Site and Repeater Sites,"$1,031,000 ",Chu,
Department of Justice,COPS Tech, CA,City of South Pasadena,South Pasadena Public Safety Radio Communications Upgrades,"$1,031,000 ",Chu,
Department of Justice,COPS Tech, CA,The Upland Police Department,Computer-Aided Dispatch/Records Management System Upgrade,"$1,031,000 ",Chu,
Department of Justice,COPS Tech, AZ,City of Tucson,Community Safety Vehicle Fleet Modernization,"$4,200,000 ",Ciscomani,
Department of Justice,COPS Tech, CA,City of Covina,Covina East San Gabriel Valley Police Communications Project,"$1,031,000 ",Cisneros,
Department of Justice,COPS Tech, CA,City of La Verne,Modernization of La Verne’s Public Safety Dispatch Center & Response Infrastructure Project,"$1,031,000 ",Cisneros,
Department of Justice,COPS Tech, CA,City of Monrovia,Monrovia Police Department’s Critical Communication Center Upgrade to Regional Interoperability Project,"$1,031,000 ",Cisneros,
Department of Justice,COPS Tech, MO,"Board of Police Commissioners of Kansas City, Missouri",Police Aviation Technology Equipment,"$1,031,000 ",Cleaver,
Department of Justice,COPS Tech, MO,"City of Lee’s Summit, Missouri",Public Safety Technology Equipment,"$1,039,000 ",Cleaver,
Department of Justice,COPS Tech, MO,Kansas City Area Transportation Authority,Public Safety Technology,"$1,031,000 ",Cleaver,
Department of Justice,COPS Tech, TN,Memphis Police Department,Memphis Police Department Equipment and Software Upgrades Project,"$1,031,000 ",Cohen,
Department of Justice,COPS Tech, VA,Fairfax County Government,Fairfax County Real Time Crime Center Enhancements for Emerging Threats,"$1,031,000 ",Connolly,
Department of Justice,COPS Tech, VA,Fairfax County Government,Advanced Disaster Management Simulator (ADMS) Training Project,"$175,000 ",Connolly,
Department of Justice,COPS Tech, VA,Fairfax County Government,Fairfax County Public Safety Communications Critical Infrastructure Project,"$1,031,000 ",Connolly,
Department of Justice,COPS Tech, CA,City of Orange,Real Time Crime Center,"$1,031,000 ",Correa,
Department of Justice,COPS Tech, CT,Coventry Police Department,Coventry Police Department Dispatch and Body Camera Equipment Upgrades,"$446,000 ",Courtney,
Department of Justice,COPS Tech, CT,Ledyard Police Department,Ledyard Police Department Dispatch System Replacement,"$229,000 ",Courtney,
Department of Justice,COPS Tech, MN,City of Burnsville,Burnsville Public Safety Mobile Command Post Replacement,"$1,039,000 ",Craig,
Department of Justice,COPS Tech, MN,City of Elko New Market,Elko New Market Police Camera Upgrades,"$104,000 ",Craig,
Department of Justice,COPS Tech, MN,City of Lonsdale,Lonsdale Public Safety Technology and Communication Improvement,"$182,000 ",Craig,
Department of Justice,COPS Tech, MN,City of Woodbury,Public Safety Communications and Response Equipment,"$1,031,000 ",Craig,
Department of Justice,COPS Tech, MN,Scott County,Scott County Law Enforcement Records Management System Upgrades,"$1,031,000 ",Craig,
Department of Justice,COPS Tech, TX,Montgomery County,East Montgomery County Radio Tower Enhancement,"$4,200,000 ",Crenshaw,
Department of Justice,COPS Tech, TX,"City of Dallas, TX",City of Dallas Police Department Helicopter Multi-Use Mapping Computers Project,"$204,000 ",Crockett,
Department of Justice,COPS Tech, TX,"City of DeSoto, Texas Police Department",City of DeSoto Police Department Violent Crime Prevention Technology Project,"$360,000 ",Crockett,
Department of Justice,COPS Tech, CO,Arapahoe County Sheriff’s Office,Law Enforcement Radio and Communications Technology Upgrades,"$1,031,000 ",Crow,
Department of Justice,COPS Tech, KS,Overland Park Police Department,Overland Park Police Department Body Camera Replacement,"$1,031,000 ",Davids,
Department of Justice,COPS Tech, PA,Allegheny Valley Regional Police Department,Police Patrol Boat,"$125,000 ",Deluzio,
Department of Justice,COPS Tech, PA,Ross Township Police Department,Body Worn Cameras/In Car Cameras,"$502,000 ",Deluzio,
Department of Justice,COPS Tech, OR,City of Gresham,Real-Time Information Center,"$907,000 ",Dexter,
Department of Justice,COPS Tech, FL,Village of Virginia Gardens,Village of Virginia Garden’s Law Enforcement Technology Upgrades,"$450,000 ",Diaz-Balart,
Department of Justice,COPS Tech, FL,Miami-Dade Sheriff’s Office,Miami-Dade Sheriff Office Mobile Operation Command Center Upgrades,"$1,050,000 ",Diaz-Balart,
Department of Justice,COPS Tech, FL,Miami-Dade Sheriff’s Office,Miami-Dade Sheriff Office Global Public Safety and Equipment Expansion,"$4,200,000 ",Diaz-Balart,
Department of Justice,COPS Tech,MI,Charter Township of Canton,Canton Township Bi-Directional Antennas Project,"$1,031,000 ",Dingell,
Department of Justice,COPS Tech, MI,Downriver Community Conference,DCC Downriver Public Safety Technology Improvements Project,"$1,031,000 ",Dingell,
Department of Justice,COPS Tech,MT,Lewis & Clark County Sheriff’s Office,Lewis and Clark County Sheriff’s Office Communications Equipment,"$500,000 ",Downing,
Department of Justice,COPS Tech,Fl,Washington County Sheriff’s Office,Washington County Sheriff’s Office Public Safety Communications Tower Upgrade,"$375,000 ",Dunn,
Department of Justice,COPS Tech, FL,Liberty County Sheriff’s Office,Bristol Microwave Site Transmit and Receive Conversion,"$495,000 ",Dunn,
Department of Justice,COPS Tech, FL,Jackson County Sheriff’s Office,Community Outreach Center,"$1,250,000 ",Dunn,
Department of Justice,COPS Tech, FL,Tallahassee Police Department (TPD),Tallahassee Police Department Training Facility Indoor Tactical Firing Range Equipment,"$2,100,000 ",Dunn,
Department of Justice,COPS Tech, NC,Yancey County Sheriff’s Office,Yancey County Sheriff’s Office Communications and Security Upgrades,"$930,000 ",Edwards,
Department of Justice,COPS Tech, MD,Annapolis Police Department,Annapolis Mobile Command Unit,"$1,031,000 ",Elfreth,
Department of Justice,COPS Tech, MD,"Anne Arundel County, Maryland",Joint 911 Public Safety Center Technology,"$1,031,000 ",Elfreth,
Department of Justice,COPS Tech, TX,Anthony Texas Police Department,Town of Anthony Texas Police Department Mobile Command Post and Technology,"$1,031,000 ",Escobar,
Department of Justice,COPS Tech, TX,Rio Grande Council of Governments,Regional Interoperable Communications Project,"$1,031,000 ",Escobar,
Department of Justice,COPS Tech, MS,"Jackson County, Mississippi",Enhancement of Jackson County Public Safety Equipment and Technology,"$1,919,422 ",Ezell,
Department of Justice,COPS Tech, AL,Bullock County Sheriff’s Department,Bullock County Sheriff Department,"$1,031,000 ",Figures,
Department of Justice,COPS Tech, TX,Fort Bend County District Attorney’s Office,Fort Bend County Digital Evidence Repository,"$1,031,000 ",Fletcher,
Department of Justice,COPS Tech, TX,Harris County Sheriff’s Office,Mobile Command Posts,"$1,031,000 ",Fletcher,
Department of Justice,COPS Tech, NE,City of Lincoln Police Department,Lincoln Police Department Cruisers,"$474,842 ",Flood,
Department of Justice,COPS Tech, CA,City of Tulare,City of Tulare’s Police Dispatch Expansion Project,"$579,150 ",Fong,
Department of Justice,COPS Tech, NC,City of Durham Police Department,Real-Time Crime Center Technology and Equipment,"$1,031,000 ",Foushee,
Department of Justice,COPS Tech, NC,Durham County Office of the Sheriff,Mobile Command Center Project,"$1,000,000 ",Foushee,
Department of Justice,COPS Tech, CA,City of Glendale,Verdugo Communications Center Equipment Upgrades,"$1,031,000 ",Friedman,
Department of Justice,COPS Tech, CA,Glendale Police Department,Real Time Intelligence Center Expansion,"$1,031,000 ",Friedman,
Department of Justice,COPS Tech, SC,City of Marion,City of Marion Police Department Equipment Upgrade Project,"$105,000 ",Fry,
Department of Justice,COPS Tech, SC,Horry County Government,Horry County Emergency Communications Enhancements Project,"$523,740 ",Fry,
Department of Justice,COPS Tech, SC,Marion County Sheriff’s Office,Marion County Sheriff’s Office County Wide Time Division Multiple Access (TDMA) Capable Radios,"$567,148 ",Fry,
Department of Justice,COPS Tech, SC,Francis Marion University,Francis Marion University (FMU) Campus Police Security Improvements,"$754,500 ",Fry,
Department of Justice,COPS Tech,SC,Chesterfield County Sheriff’s Office,Chesterfield County Radio Improvement Project,"$3,943,978 ",Fry,
Department of Justice,COPS Tech, CA,County of Solano,Solano County Radio Infrastructure and Interoperability Improvements,"$1,031,000 ",Garamendi,
Department of Justice,COPS Tech, CA,The City of Vallejo Police Department,Vallejo Police Department’s Resiliency and Elevated Public Safety Project (Mobile Unit),"$1,031,000 ",Garamendi,
Department of Justice,COPS Tech, IL,Village of Stickney Department of Police,Stickney Police Radio Upgrades,"$428,000 ",Garcia (IL),
Department of Justice,COPS Tech, NY,Incorporated Village of Rockville Centre,Rockville Centre Police Security Cameras,"$1,031,000 ",Gillen,
Department of Justice,COPS Tech, FL,City of Sweetwater,City of Sweetwater Policing Equipment and Safety Project,"$1,050,000 ",Gimenez,
Department of Justice,COPS Tech, TX,Terrell County Sheriff’s Office,Terrell County Law Enforcement Communications Upgrades,"$3,200,000 ",Gonzales, Tony (TX)
Department of Justice,COPS Tech, TX,Medina County,Medina County Radio Communications Upgrades,"$4,200,000 ",Gonzales, Tony (TX)
Department of Justice,COPS Tech, TX,North East Independent School District (ISD) Police Department,North East Independent School District (NEISD) Law Enforcement Safety and Security Enhancements,"$4,200,000 ",Gonzales, Tony (TX)
Department of Justice,COPS Tech, TX,Cameron County Sheriff’s Office,Cameron County Sheriff’s Bulletproof Windshields,"$375,000 ",Gonzalez,
Department of Justice,COPS Tech, NH,Cheshire County,Portable Radio Update Cheshire County Law Enforcement,"$300,000 ",Goodlander,
Department of Justice,COPS Tech, NJ,Bergenfield Police Department,Emergency Services Communications Equipment Improvement Project,"$1,031,000 ",Gottheimer,
Department of Justice,COPS Tech, CA,City of Modesto,City of Modesto Police Enhanced Radio System,"$1,031,000 ",Gray,
Department of Justice,COPS Tech, GA,Floyd County Board of Commissioners,Communications Improvement Strategy for Floyd County,"$1,731,500 ",Greene,
Department of Justice,COPS Tech, VA,"City of Bristol, Virginia","Police Vehicles for the City of Bristol, Virginia Project","$294,800 ",Griffith,
Department of Justice,COPS Tech, VA,"Franklin County, VA",Franklin County Law Enforcement Radio Upgrades Project,"$607,968 ",Griffith,
Department of Justice,COPS Tech, VA,Craig County Sheriff’s Office,Craig County Emergency Communications Project,"$1,400,000 ",Griffith,
Department of Justice,COPS Tech, VA,Dickenson County Board of Supervisors,Dickenson County Sheriff’s Department Public Safety Communications Upgrade Project,"$859,095 ",Griffith,
Department of Justice,COPS Tech,VA,New River Valley Emergency Communications Regional Authority,New River Valley Emergency Communications Regional Authority (NRVECRA) Interoperable P25 Public Safety Communications System Project,"$2,100,000 ",Griffith,
Department of Justice,COPS Tech, WY,"Carbon County, WY",Police Pursuit Vehicle Acquisition,"$600,000 ",Hageman,
Department of Justice,COPS Tech, AZ,City of Phoenix,Law Enforcement Simulator Training Equipment,"$1,900,000 ",Hamadeh,
Department of Justice,COPS Tech, CA,City of Lodi,Lodi Police Department’s Regional Training Facility,"$1,031,000 ",Harder,
Department of Justice,COPS Tech, CA,City of Manteca,Manteca PD’s Real Time Information Center,"$599,000 ",Harder,
Department of Justice,COPS Tech, CA,City of Stockton,City of Stockton’s Combating Crime in Real Time Program,"$1,000,000 ",Harder,
Department of Justice,COPS Tech, NC,Town of Catawba,Town of Catawba Police Fleet Upgrade,"$353,015 ",Harrigan,
Department of Justice,COPS Tech, NC,City of Statesville,City of Statesville Tactical Multipurpose Response and Rescue Vehicle and Dispatching Consoles Project,"$573,779 ",Harrigan,
Department of Justice,COPS Tech, NC,"Lincoln County, North Carolina",Mobile Command TruckEmergency Operations Center (EOC),"$900,000 ",Harrigan,
Department of Justice,COPS Tech, LA,Vermilion Parish Sheriff’s Office,Vermilion Parish Portable and Mobile Radio Upgrades,"$1,467,002 ",Higgins,
Department of Justice,COPS Tech, IA,Howard County Sheriff’s Department,Howard County Sheriff’s Department Communication and Radio Project,"$1,364,725 ",Hinson,
Department of Justice,COPS Tech, IA,Hardin County Sheriff,Hardin County Radio Infrastructure Project,"$3,054,209 ",Hinson,
Department of Justice,COPS Tech, NV,Lyon County,Mobile Crisis Response Co-Responder Vehicle,"$90,000 ",Horsford,
Department of Justice,COPS Tech, NV,Nye County,NV Security Enhancements Project,"$1,031,000 ",Horsford,
Department of Justice,COPS Tech, OR,City of Corvallis,Corvallis Backup 9–1–1 Center,"$1,031,000 ",Hoyle,
Department of Justice,COPS Tech, CA,"County of Humboldt, Sheriff’s Office",Humboldt County Sheriff’s Office Law Enforcement Computer Replacement,"$153,000 ",Huffman,
Department of Justice,COPS Tech, TX,City of Houston Police Department,Houston Police Department Domestic Abuse Response Team Patrol Initiative,"$1,000,000 ",Hunt,
Department of Justice,COPS Tech, IL,Chicago State University,Community Centered Security Measures for Chicago State University Police Department,"$908,000 ",Jackson (IL),
Department of Justice,COPS Tech, IL,Village of Evergreen Park,Evergreen Park Police Department Body Worn Camera and In-Squad Video System Project,"$487,000 ",Jackson (IL),
Department of Justice,COPS Tech, CA,Office of Exposition Park Management,Exposition Park Public Safety Parkwide Surveillance,"$1,039,000 ",Kamlager-Dove,
Department of Justice,COPS Tech, NJ,Township of Warren,"Township of Warren, New Jersey Public Safety Communications Equipment Upgrade","$900,000 ",Kean,
Department of Justice,COPS Tech, IL,County of Iroquois,"Emergency Services Interoperable Radio Communications Project Iroquois County, IL","$1,039,000 ",Kelly (IL),
Department of Justice,COPS Tech,MS,Chickasaw County Board of Supervisors,Chickasaw County Sheriff Department COPS Project,"$1,000,000 ",Kelly (MS),
Department of Justice,COPS Tech, MS,"City of West Point, MS","West Point, MS West Point Crime Prevention Initiative","$1,000,000 ",Kelly (MS),
Department of Justice,COPS Tech, UT,Utah Department of Public Safety,Utah Department of Public Safety Narcotics Field Testing Equipment,"$800,000 ",Kennedy (UT),
Department of Justice,COPS Tech,VA,Southampton County,Southampton Franklin Regional Emergency Communications Network,"$629,834 ",Kiggans,
Department of Justice,COPS Tech, CA,Nevada City Police Department,Nevada City Police Department Portable Radio Equipment Replacement,"$350,000 ",Kiley,
Department of Justice,COPS Tech, CA,City of Anaheim,Anaheim Police Department Real Time Crime Center,"$500,000 ",Kim,
Department of Justice,COPS Tech, CA,City of Tustin,Tustin Security Improvement Project,"$2,500,000 ",Kim,
Department of Justice,COPS Tech, IL,Kane County State’s Attorney’s Office,Kane County State’s Attorney’s Office Technology Upgrades,"$1,000,000 ",Krishnamoorthi,
Department of Justice,COPS Tech, IL,Palatine Police Department,Community Engagement Enhancement & Patrol Project,"$239,000 ",Krishnamoorthi,
Department of Justice,COPS Tech, IL,City of Bloomington,Real Time Information and Crime Center,"$556,900 ",LaHood,
Department of Justice,COPS Tech, NY,Southold Town Police Department,Southold Town Police Department Radio Upgrades,"$132,857 ",LaLota,
Department of Justice,COPS Tech,NY,Southampton Town Police Department,Southampton Town Police Department Mobile Command Center Technology Upgrades,"$782,100 ",LaLota,
Department of Justice,COPS Tech, WA,Whatcom County Sheriff’s Office,Whatcom County Sheriff’s Office Portable Radio Replacement Project,"$600,000 ",Larsen,
Department of Justice,COPS Tech, NY,Mount Vernon Police Department,Mount Vernon Police Document Conversion Project,"$539,000 ",Latimer,
Department of Justice,COPS Tech, FL,"City of Plant City, Florida",Vehicle Incident Prevention and Mitigation Program,"$515,586 ",Lee (FL),
Department of Justice,COPS Tech, CA,County of Orange,County of Orange Law Enforcement Fleet Modernization,"$1,031,000 ",Levin,
Department of Justice,COPS Tech, CA,City of San Jose,Copper Theft and Wire Vandalism Video Surveillance System,"$1,031,000 ",Liccardo,
Department of Justice,COPS Tech, CA,City of Hermosa Beach,Real Time Crime Center Project,"$1,031,000 ",Lieu,
Department of Justice,COPS Tech, CA,City of Santa Monica,Dispatch Center Communications Upgrade Project,"$841,000 ",Lieu,
Department of Justice,COPS Tech, CA,City of Torrance,Public Safety Digital Infrastructure Expansion Project,"$1,031,000 ",Lieu,
Department of Justice,COPS Tech, FL,City of St. Petersburg,St. Petersburg Police Public Safety Vehicles,"$480,000 ",Luna,
Department of Justice,COPS Tech, TX,City of Houston Houston Police Department,City of Houston Houston Police Department,"$1,450,000 ",Luttrell,
Department of Justice,COPS Tech, MA,City of Brockton,Brockton Public Safety Building Equipment,"$1,031,000 ",Lynch,
Department of Justice,COPS Tech, PA,County of Carbon,Carbon County Sheriff Equipment and Technology Upgrades,"$60,000 ",Mackenzie,
Department of Justice,COPS Tech, PA,Bethlehem Township,Freedom High School Emergency Communications Amplifier Project,"$120,000 ",Mackenzie,
Department of Justice,COPS Tech, PA,Northampton Borough,Radio Mandate Switch Over Project,"$201,441 ",Mackenzie,
Department of Justice,COPS Tech, PA,Palmer Township,Palmer Township Emergency Radio Project,"$474,861 ",Mackenzie,
Department of Justice,COPS Tech, PA,Bethlehem Police Department,Bethlehem Police Department Equipment and Technology,"$700,000 ",Mackenzie,
Department of Justice,COPS Tech, PA,Carbon County,Carbon County P25 Radio,"$2,100,000 ",Mackenzie,
Department of Justice,COPS Tech, RI,City of Warwick,Warwick Police Department Communications Upgrades,"$800,000 ",Magaziner,
Department of Justice,COPS Tech, RI,Town of Foster,Foster Emergency Services Communications,"$475,000 ",Magaziner,
Department of Justice,COPS Tech, RI,Town of West Warwick,West Warwick Police Department Vehicles for Crisis and Investigation,"$791,000 ",Magaziner,
Department of Justice,COPS Tech, NY,New York City Police Department,Camera Safety Upgrades,"$460,500 ",Malliotakis,
Department of Justice,COPS Tech, UT,City of St. George Utah Police Department,Public Safety Technology Upgrade Project,"$1,113,368 ",Maloy,
Department of Justice,COPS Tech, FL,St. Lucie County Sheriff’s Office,St. Lucie County Real-Time Information Crime,"$475,000 ",Mast,
Department of Justice,COPS Tech, CA,City of Elk Grove,Real-Time Information Center Enhancements,"$581,000 ",Matsui,
Department of Justice,COPS Tech, GA,City of Sandy Springs,Backup Emergency 911 Communications Center,"$1,031,000 ",McBath,
Department of Justice,COPS Tech, DE,New Castle County,New Castle County Police Vehicle Enhancement,"$1,031,000 ",McBride,
Department of Justice,COPS Tech, TX,Texas A&M University,Texas A&M University System (TAMUS) University Police Department (UPD) & Local Law Enforcement Agency (LEA) Technology and Equipment Upgrades,"$1,741,363 ",McCaul,
Department of Justice,COPS Tech, GA,Roswell Police Department,Roswell’s Public Safety Technology Enhancement Project,"$1,000,000 ",McCormick (GA),
Department of Justice,COPS Tech, GA,Sandy Springs Police Department,Backup Emergency 911 Communications Center,"$2,000,000 ",McCormick (GA),
Department of Justice,COPS Tech, NC,City of High Point,Law Enforcement Comparator Upgrades,"$365,000 ",McDowell,
Department of Justice,COPS Tech, NJ,City of Linden,The City of Linden Emergency Dispatch Center Enhancement Project,"$1,031,000 ",McIver,
Department of Justice,COPS Tech, NJ,Borough of East Newark,Public Safety Equipment and Infrastructure Enhancement,"$1,031,000 ",Menendez,
Department of Justice,COPS Tech, NJ,Township of Weehawken,Weehawken Police Department Public Safety Communications Project,"$775,000 ",Menendez,
Department of Justice,COPS Tech, NY,New York City Police Department,NYPD ITB Tech Project,"$1,031,000 ",Meng,
Department of Justice,COPS Tech, NY,New York City Police Department,Public Safety and Emergency Management Mobile Command Center (MCC),"$1,031,000 ",Meng,
Department of Justice,COPS Tech, MD,Baltimore Police Department,Computer Aided Dispatch Replacement,"$2,062,000 ",Mfume;,
Department of Justice,COPS Tech, FL,Seminole County Government,Seminole County Sheriff’s Vehicular Mobile Radio Upgrade Project,"$1,900,000 ",Mills,
Department of Justice,COPS Tech, CA,City of Costa Mesa,Costa Mesa Real Time Crime Center,"$1,039,000 ",Min,
Department of Justice,COPS Tech, AL,Baldwin County Commission,Fort Morgan Public Beach Safety Markers,"$500,000 ",Moore (AL),
Department of Justice,COPS Tech, AL,Houston County Sheriff’s Office,Policing Equipment and Technology Upgrades,"$325,000 ",Moore (AL),
Department of Justice,COPS Tech, AL,The City of Atmore,Atmore Police Department Radio Communication Equipment Upgrade,"$375,000 ",Moore (AL),
Department of Justice,COPS Tech, NC,City of Cornelius Police Department,Cornelius Police Department Equipment Purchase,"$332,096 ",Moore (NC),
Department of Justice,COPS Tech, UT,Ogden City Corporation,"Ogden, Utah Police Department Training Simulator","$630,000 ",Moore (UT),
Department of Justice,COPS Tech, WI,City of Milwaukee,Milwaukee Police Department’s Public Safety Radio System Upgrade Project,"$1,031,000 ",Moore (WI),
Department of Justice,COPS Tech, WI,City of West Allis Police Department,Communications Unit Public Safety Dispatch Consoles and Equipment Project,"$815,000 ",Moore (WI),
Department of Justice,COPS Tech, TX,"Shelby County, Texas",Shelby County Interoperable Communications Infrastructure Equipment,"$1,550,000 ",Moran,
Department of Justice,COPS Tech, NY,City of Rochester,Rochester Police Department Body-Worn Camera Program,"$210,000 ",Morelle,
Department of Justice,COPS Tech, FL,City of Coconut Creek,Fiber Optic Ring for Resiliency & Redundancy of Fiber Optics Network,"$1,031,000 ",Moskowitz,
Department of Justice,COPS Tech, FL,City of Wilton Manors,Wilton Manors Security Upgrade,"$1,010,000 ",Moskowitz,
Department of Justice,COPS Tech, IN,City of Crown Point,Crown Point Police Department Radio Replacement Project,"$1,000,000 ",Mrvan,
Department of Justice,COPS Tech, IN,City of East Chicago,East Chicago Police Department Radio Replacement Project,"$520,000 ",Mrvan,
Department of Justice,COPS Tech, IN,City of La Porte,La Porte Police Department Equipment and Technology Upgrades,"$400,000 ",Mrvan,
Department of Justice,COPS Tech, IN,City of Valparaiso,Valparaiso Police Department Portable Radio Upgrades,"$398,000 ",Mrvan,
Department of Justice,COPS Tech, IN,Civil Town of Dyer,Dyer Police Department Radio Communications Enhancement,"$306,000 ",Mrvan,
Department of Justice,COPS Tech, IN,Town of Griffith Police Department,Police Radio Upgrade Project,"$400,000 ",Mrvan,
Department of Justice,COPS Tech, IN,Town of Lowell,Lowell Police Department Portable Radio Replacements,"$244,000 ",Mrvan,
Department of Justice,COPS Tech, IN,Town of Schererville,Schererville Police Department Portable Radio Replacements,"$670,000 ",Mrvan,
Department of Justice,COPS Tech, CA,City of San Mateo,City of San Mateo Real Time Information Center Technology,"$550,000 ",Mullin,
Department of Justice,COPS Tech, NC,East Carolina University,East Carolina University (ECU) Police Department Software Upgrades,"$254,856 ",Murphy,
Department of Justice,COPS Tech, NC,Town of Winterville,Emergency Services Portable Mobile Radio Replacement,"$510,594 ",Murphy,
Department of Justice,COPS Tech, CO,Jackson County Sheriff’s Office,"Jackson County Sheriff’s Office Equipment Upgrades, CO","$913,000 ",Neguse,
Department of Justice,COPS Tech, CA,City of Victorville,New Victorville Police Station Technology Advancement to Develop Real Time Crime and Viewing Center,"$3,000,000 ",Obernolte,
Department of Justice,COPS Tech, MO,St. Charles County Police Department,Missouri Internet Crimes Against Children Child Exploitation Technology Project,"$620,000 ",Onder,
Department of Justice,COPS Tech, MO,Washington County Central Dispatch 911,Washington County Central Dispatch 911 Public Safety Infrastructure Project,"$2,100,000 ",Onder,
Department of Justice,COPS Tech, UT,City of Taylorsville,Taylorsville Police Department Law Enforcement Equipment Upgrade,"$683,170 ",Owens,
Department of Justice,COPS Tech,NJ,Borough of Carteret,Carteret Law Enforcement Communications Equipment Upgrades,"$1,031,000 ",Pallone,
Department of Justice,COPS Tech, CA,City of Scotts Valley,Public Safety Answering Point Radio Equipment Project,"$682,000 ",Panetta,
Department of Justice,COPS Tech, NH,City of Portsmouth Police Department,Portsmouth Police IT & Security,"$1,031,000 ",Pappas,
Department of Justice,COPS Tech, NH,Newmarket Police Department,Newmarket Police Department Technology Upgrades,"$400,000 ",Pappas,
