Agency,Account,State,Recipient,Project, Amount ,Requested by,Requested by 2
Department of Justice,OJP Byrne, WI,"Word of Hope Ministries, Inc",Comprehensive Prevention and Education Program,"$300,000 ",Moore (WI),
Department of Justice,OJP Byrne, NY,"Christ for Kids Ministries, Inc","Job Training, Therapeutic Services, and Support for Survivors of Trafficking","$477,000 ",Morelle,
Department of Justice,OJP Byrne, NY,Coordinated Care Services Inc.,Rise Up Rochester: Safe Housing Violence Response Program,"$500,000 ",Morelle,
Department of Justice,OJP Byrne, NY,Lollypop Farm Humane Society of Greater Rochester,Humane Law Enforcement,"$344,000 ",Morelle,
Department of Justice,OJP Byrne, MN,City of Minnetonka,Minnetonka Police Records Management System,"$966,000 ",Morrison,
Department of Justice,OJP Byrne, MN,Hennepin Technical College Foundation,Hennepin Technical College Public Safety Cross-Functional Training Center,"$1,031,000 ",Morrison,
Department of Justice,OJP Byrne, MN,Maria Pew Family Foundation DBA Maria’s Voice,Domestic Violence Prevention Education Initiative,"$300,000 ",Morrison,
Department of Justice,OJP Byrne, FL,Broward Sheriff’s Office,School Safety Response Equipment and Training Enhancement,"$366,000 ",Moskowitz,
Department of Justice,OJP Byrne, GU,Guam Police Department,Tiyan/Barrigada (GU) Guam Police Department Patrol Vehicles,"$990,500 ",Moylan,
Department of Justice,OJP Byrne, GU,Guam Customs and Quarantine Agency,Tiyan (GU) Guam Customs and Quarantine Agency Inspection Equipment,"$1,025,000 ",Moylan,
Department of Justice,OJP Byrne, IN,City of Hobart Police Department,Body Worn Camera Project,"$488,000 ",Mrvan,
Department of Justice,OJP Byrne, IN,"Town of Chesterton, Indiana",Chesterton Police Department Virtual Reality Training System,"$85,000 ",Mrvan,
Department of Justice,OJP Byrne, IN,Town of Winfield,Winfield Police Department Body Worn Camera Project,"$70,000 ",Mrvan,
Department of Justice,OJP Byrne, NC,Onslow County Sherriff’s Office,Rapid DNA Program,"$682,553 ",Murphy,
Department of Justice,OJP Byrne, NY,Research Foundation of The City University of New York,Launching a Certification Course for Law Enforcement and Criminal Justice Personnel to Build Partnerships to Address Violent Crime,"$1,031,000 ",Nadler,
Department of Justice,OJP Byrne, TX,Big Brothers Big Sisters Lone Star,Big Brothers Big Sisters Lone Star,"$500,000 ",Nehls,
Department of Justice,OJP Byrne, TX,Child Advocates Ft. Bend County,Child Advocates of Ft. Bend County (CAFB),"$500,000 ",Nehls,
Department of Justice,OJP Byrne, TX,Ft. Bend County Women’s Center,Ft. Bend County Women’s Center,"$1,000,000 ",Nehls,
Department of Justice,OJP Byrne, NY,Elmcor Youth & Adult Activities Inc.,B.R.A.V.E. Response to Recent Youth Violence in Queens,"$100,000 ",Ocasio-Cortez,
Department of Justice,OJP Byrne, NY,Icahn School of Medicine at Mount Sinai,Sexual Assault and Violence Intervention Program (SAVI),"$500,000 ",Ocasio-Cortez,
Department of Justice,OJP Byrne, NY,"Thrive For Life Prison Project, Inc.",Bronx First Chance for Reentry Success,"$1,000,000 ",Ocasio-Cortez,
Department of Justice,OJP Byrne, MD,Loyola University Maryland,Forensics Science Program,"$965,000 ",Olszewski,
Department of Justice,OJP Byrne, MN,Generation Hope MN,The Justice Empowerment Initiative by Generation Hope,"$1,031,000 ",Omar,
Department of Justice,OJP Byrne, UT,Juab County Sheriff’s Office,Juab County Sheriff’s Office Law Enforcement Equipment Upgrade Project,"$394,149 ",Owens,
Department of Justice,OJP Byrne, UT,Unified Police Department of Greater Salt Lake,Unified Police Department Law Enforcement Equipment Upgrade Project,"$1,081,366 ",Owens,
Department of Justice,OJP Byrne, CA,"Bayview-Hunters Point Multipurpose Senior Services, Inc.",Senior Ex-Offender Program Community and Rehabilitation Center Expansion,"$900,000 ",Pelosi,
Department of Justice,OJP Byrne, CA,San Francisco Police Department,SFPD Patrol Vehicles,"$1,031,000 ",Pelosi,
Department of Justice,OJP Byrne, CO,Porchlight A Family Justice Center,Porchlight A Family Justice Center Expansion,"$849,000 ",Pettersen,
Department of Justice,OJP Byrne, ME,University of Maine School of Law,University of Maine School of Law Pilot Criminal Justice Clinic,"$1,000,000 ",Pingree,
Department of Justice,OJP Byrne,VI,Community Restore Inc.,Project Cultiv8te,"$141,000 ",Plaskett,
Department of Justice,OJP Byrne,VI,Family Resource Center Inc.,Family Resource Center Emergency Shelter and Victim Services Expansion Project,"$1,031,000 ",Plaskett,
Department of Justice,OJP Byrne, WI,Boys and Girls Clubs of Dane County,"Youth Crime Prevention, Education, and Awareness Project","$1,000,000 ",Pocan,
Department of Justice,OJP Byrne, WI,University of Wisconsin Madison,UW–Madison Criminal Justice Forensic Assistance Program,"$1,031,000 ",Pocan,
Department of Justice,OJP Byrne, NJ,Borough of East Rutherford,Public Safety Communications Equipment,"$350,000 ",Pou,
Department of Justice,OJP Byrne, MA,"BMA Ten Point, Inc.",BMA Ten Point Family Initiative,"$275,000 ",Pressley,
Department of Justice,OJP Byrne, MA,"Children’s Advocacy Center of Suffolk County, Inc.",Children’s Advocacy Center of Suffolk County Victim Support Improvements,"$1,031,000 ",Pressley,
Department of Justice,OJP Byrne, MA,"Justice For Housing, Inc.","Stable Housing & Reintegration Program, SHARP","$250,000 ",Pressley,
Department of Justice,OJP Byrne, MA,Louis D. Brown Peace Institute,Louis D. Brown Peace Institute Community Violence Intervention Program,"$1,031,000 ",Pressley,
Department of Justice,OJP Byrne, MA,The American City Coalition,Roxbury Worx,"$1,031,000 ",Pressley,
Department of Justice,OJP Byrne, MA,The Phoenix,Expansion of Recovery Resources at The Phoenix,"$682,000 ",Pressley,
Department of Justice,OJP Byrne, IL,Chicago Police Memorial Foundation,Get Behind the Vest,"$1,031,000 ",Quigley,
Department of Justice,OJP Byrne, WA,Turning Pointe Survivor Advocacy Center,Essential domestic violence shelter services for safety and self-sufficiency,"$238,000 ",Randall,
Department of Justice,OJP Byrne, MD,City of Takoma Park,Public Safety Dispatch Center and Crisis Response Upgrades,"$867,000 ",Raskin,
Department of Justice,OJP Byrne,MD,Montgomery County Police Department,Forensic Laboratory Capabilities Enhancement,"$1,031,000 ",Raskin,
Department of Justice,OJP Byrne,MD,Montgomery County Police Department,Real Time Crime Center (RTCC) Enhancement,"$1,031,000 ",Raskin,
Department of Justice,OJP Byrne,MD,"Roca, Inc.",Law Enforcement Training,"$487,000 ",Raskin,
Department of Justice,OJP Byrne,PA,Westmoreland County,Westmoreland County Technology Upgrade,"$643,355 ",Reschenthaler,
Department of Justice,OJP Byrne, KY,"Unlawful Narcotics Investigations, Treatment, and Education Inc.",Operation UNITE Substance Abuse Prevention and Treatment,"$2,000,000 ",Rogers (KY),
Department of Justice,OJP Byrne, NC,North Carolina State Bureau of Investigation,North Carolina Internet Crimes Against Children Task Force Equipment,"$814,000 ",Ross,
Department of Justice,OJP Byrne, NC,Raleigh Boots On The Ground,Raleigh Boots on the Ground Community Violence Intervention,"$295,000 ",Ross,
Department of Justice,OJP Byrne, NC,Town of Wendell Police Department,Wendell Police Department In-Car Camera Project,"$259,000 ",Ross,
Department of Justice,OJP Byrne,NC,"Cumberland County, North Carolina",Mobile Incident Command Post,"$994,593 ",Rouzer,
Department of Justice,OJP Byrne, FL,"Pace Center for Girls, Inc.","Security and Safety Equipment for the Pace Center for Girls in Jacksonville, FL, a Juvenile Justice Prevention and Early Intervention Program","$300,000 ",Rutherford,
Department of Justice,OJP Byrne, FL,City of Jacksonville,City of Jacksonville Marked Patrol Vehicles,"$4,200,000 ",Rutherford,
Department of Justice,OJP Byrne, NY,County of Orange,Orange County Jail Body Cameras,"$785,000 ",Ryan,
Department of Justice,OJP Byrne, NY,Dutchess County Sheriff’s Office,Dutchess County Analysis and Real Time Crime,"$1,031,000 ",Ryan,
Department of Justice,OJP Byrne, NY,Ulster County Sheriff’s Office,Ulster County Sheriff Policing Equipment and Technology Upgrades,"$794,000 ",Ryan,
Department of Justice,OJP Byrne,FL,Miami-Dade Sheriff’s Office (MDSO),Miami-Dade Sheriff’s Office Violence Reduction Initiative,"$1,250,000 ",Salazar,
Department of Justice,OJP Byrne, FL,City of Miami,City of Miami Marked Police Cruisers,"$2,100,000 ",Salazar,
Department of Justice,OJP Byrne, OR,City of Beaverton,City of Beaverton Behavioral Health Court,"$500,000 ",Salinas,
Department of Justice,OJP Byrne, OR,Liberty House,Liberty House Clinical Services for Children Facing Concerns of Abuse or Neglect,"$1,000,000 ",Salinas,
Department of Justice,OJP Byrne,OR,Washington County,Washington County Sheriff’s Office Patrol Equipment,"$1,031,000 ",Salinas,
Department of Justice,OJP Byrne,CA,Rı´o Hondo Community College District,Public Safety Scenario Training Unit (PSSTU),"$1,031,000 ",Sanchez (CA),
Department of Justice,OJP Byrne, LA,Tangipahoa Parish Government,Emergency Operations Mobile Command Center,"$2,194,993 ",Scalise,
Department of Justice,OJP Byrne,PA,County of Delaware,Delaware County Client Advocates Program,"$902,000 ",Scanlon,
Department of Justice,OJP Byrne, PA,Villanova University,Villanova University Legal Support Clinic,"$850,000 ",Scanlon,
Department of Justice,OJP Byrne, KS,Shawnee County Department of Corrections,Operation and Development of Behavioral Health Units within Detention Facility,"$750,000 ",Schmidt,
Department of Justice,OJP Byrne, IL,Lake County State’s Attorney’s Office,Lake County State’s Attorney’s Community Violence Intervention Project,"$1,000,000 ",Schneider,
Department of Justice,OJP Byrne, MI,Kent County,Real Time Intelligence Center (RTIC),"$750,000 ",Scholten,
Department of Justice,OJP Byrne, WA,Chelan County Sheriff’s Office,"Chelan County Sheriff’s Office De-escalation Tools Chelan County, WA","$713,000 ",Schrier,
Department of Justice,OJP Byrne, WA,City of Issaquah Police Department,"Issaquah Police Department Body Worn Cameras Equipment Issaquah, WA","$452,000 ",Schrier,
Department of Justice,OJP Byrne, WA,King County Sheriff’s Office,"King County Sheriff’s Office Air Support Unit Upgrade Program Seattle, WA","$1,031,000 ",Schrier,
Department of Justice,OJP Byrne, GA,City of Jonesboro Police Department,Jonesboro Enhancing Law Enforcement and Public Safety Project,"$1,031,000 ",Scott (GA),
Department of Justice,OJP Byrne, GA,City of Lawrenceville Police Department,Lawrenceville Police Department Equipment and Technology Update Project,"$1,031,000 ",Scott (GA),
Department of Justice,OJP Byrne, GA,Clayton County Police Department,Clayton County Police Department Precinct Anti-Crime Taskforce Project,"$1,031,000 ",Scott (GA),
Department of Justice,OJP Byrne, GA,Newton County Sheriff’s Office,Newton County Sheriff Department Equipment Project,"$39,000 ",Scott (GA),
Department of Justice,OJP Byrne, VA,"An Achievable Dream, Inc.",An Achievable Dream Social and Emotional Support and Crisis Prevention,"$790,000 ",Scott (VA),
Department of Justice,OJP Byrne, VA,City of Newport News,Crime Prevention and Youth Diversion Program,"$750,000 ",Scott (VA),
Department of Justice,OJP Byrne, VA,Hampton Roads Police Athletic League,Hampton Roads Youth Crime Prevention and Community Engagement Program,"$860,000 ",Scott (VA),
Department of Justice,OJP Byrne, VA,Urban League of Hampton Roads,Incarcerated Persons Reentry Initiative,"$1,039,000 ",Scott (VA),
Department of Justice,OJP Byrne, AL,City of Brighton,Project Brighton S.E.T: Strengthening Brighton’s Police Force for a Safer Community,"$750,000 ",Sewell,
Department of Justice,OJP Byrne,CA,Beit T’Shuvah,"The Combatting Crime through Integrate Substance Use Disorder Treatment, Education and Prevention Program","$1,039,000 ",Sherman,
Department of Justice,OJP Byrne,CA,The Jewish Federation Council of Greater Los Angeles,The Community Security Initiative Program,"$1,031,000 ",Sherman,
Department of Justice,OJP Byrne,CA,City of Los Angeles,The Crisis and Incident Response through Community-led Engagement Program,"$2,062,000 ",Sherman,Rivas
Department of Justice,OJP Byrne, NJ,Essex County Sheriff Department,Special Needs Assistance Technology,"$375,000 ",Sherrill,
Department of Justice,OJP Byrne, NJ,New Jersey State Police,Safety Inspection Enhancement Program,"$400,000 ",Sherrill,
Department of Justice,OJP Byrne, CA,City of Oakland,City of Oakland Department of Violence Prevention Enhancements (Operation Ceasefire),"$1,039,000 ",Simon,
Department of Justice,OJP Byrne,NJ,Covenant House New Jersey,Covenant House Statewide Human Trafficking Prevention Program for Schools,"$247,000 ",Smith (NJ),
Department of Justice,OJP Byrne, NJ,"Dottie’s House, Inc.",Dottie’s House Domestic Violence Shelter Continuation of Services,"$271,498 ",Smith (NJ),
Department of Justice,OJP Byrne, NJ,Lakewood Shomrim Inc. DBA Lakewood Civilian Safety Watch,Lakewood Shomrim Radio Communication Enhancement Project,"$275,000 ",Smith (NJ),
Department of Justice,OJP Byrne, NJ,Ocean County Sheriff’s Department,Ocean County Sheriff’s Office Fleet Augmentation,"$480,000 ",Smith (NJ),
Department of Justice,OJP Byrne, WA,City of Seattle,Post-Overdose Response Team Expansion,"$1,031,000 ",Smith (WA),
Department of Justice,OJP Byrne, WA,City of Seattle,WELD King County Jail Pilot Housing and Successful Reentry Program,"$1,031,000 ",Smith (WA),
Department of Justice,OJP Byrne, WA,Purpose Dignity Action,Chinatown-International District Public Safety Team Project,"$1,039,000 ",Smith (WA),
Department of Justice,OJP Byrne, FL,Osceola Sheriff’s Office,Central Florida Internet Crimes Against Children Task Force Equipment,"$1,000,000 ",Soto,
Department of Justice,OJP Byrne, NY,Clinton County Sheriff’s Office,"Clinton County, NY, Maritime Patrol Vessel","$500,000 ",Stefanik,
Department of Justice,OJP Byrne, FL,All Star Children’s Foundation,Juvenile Justice Prevention Services Program,"$4,200,000 ",Steube,
Department of Justice,OJP Byrne, MI,Oakland County,Safer Michigan with CLEMIS,"$1,031,000 ",Stevens,
Department of Justice,OJP Byrne, AL,Town of Somerville,Somerville Police Department Public Safety Vehicles and Equipment,"$199,762 ",Strong,
Department of Justice,OJP Byrne, AL,City of Priceville,Priceville Police Department Public Safety Equipment Modernization,"$592,305 ",Strong,
Department of Justice,OJP Byrne, IN,Fort Wayne Police Department,Fort Wayne Police Department Rapid DNA Machine Procurement,"$500,000 ",Stutzman,
Department of Justice,OJP Byrne, VA,Boulder Crest Foundation,Peer-Led Posttraumatic Growth Training for Law Enforcement,"$1,000,000 ",Subramanyam,
Department of Justice,OJP Byrne, CA,Alameda County Sheriff’s Office,Alameda County Sheriff’s Office Law Enforcement Mental Health and Wellness Platform,"$700,000 ",Swalwell,
Department of Justice,OJP Byrne, CA,Magnolia Women’s Recovery Programs,"Legal Support for Criminal Justice, Public Safety, and Reentry Initiative","$403,000 ",Swalwell,
Department of Justice,OJP Byrne, OH,Clermont County Coroner’s Office,Clermont County Coroner Forensics Lab,"$400,800 ",Taylor,
Department of Justice,OJP Byrne, MI,UNITAS North America,UNITY Detroit Center for Victims of Exploitation and Trafficking,"$1,031,000 ",Thanedar,
Department of Justice,OJP Byrne, PA,Jefferson County,Jefferson County 911 Center,"$462,416 ",Thompson (PA),
Department of Justice,OJP Byrne, NV,City of Henderson,Last Warning Shot Initiative,"$1,031,000 ",Titus,
Department of Justice,OJP Byrne, MI,City of Detroit,City of Detroit Pathway to Employment,"$600,000 ",Tlaib,
Department of Justice,OJP Byrne, CA,Autism Society Inland Empire,Inland Empire Law Enforcement Training Initiative,"$1,031,000 ",Torres (CA),
Department of Justice,OJP Byrne, NY,New York City Health + Hospitals/Lincoln Hospital,New York City Health + Hospitals/Lincoln Hospital Youth Violence Intervention Initiative,"$350,000 ",Torres (NY),
Department of Justice,OJP Byrne, CA,Ontario-Montclair School District (OMSD),Ontario-Montclair School District’s Safer Schools Initiative,"$1,031,000 ",Torres (CA),
Department of Justice,OJP Byrne, NY,Police Athletic League (PAL),Crime Prevention Through Youth Development,"$500,000 ",Torres (NY),
Department of Justice,OJP Byrne, MA,The Phoenix,The Phoenix Essex County Community Reentry Project,"$750,000 ",Trahan,
Department of Justice,OJP Byrne, CA,HOPE Center of Orange County,North Orange County Public Safety Collaborative,"$1,031,000 ",Tran,
Department of Justice,OJP Byrne, IL,Joliet Township,"Law Enforcement Collaboration to Prevent Workplace Crime in Will County, IL","$339,000 ",Underwood,
Department of Justice,OJP Byrne, IL,Will County Workforce Services DivisionLWIA–10,"Reducing Recidivism and Supporting Reentry in Will County, IL","$600,000 ",Underwood,
Department of Justice,OJP Byrne, NJ,HERO Campaign for Designated Drivers,HERO Campaign for Designated Drivers,"$500,000 ",Van Drew,
Department of Justice,OJP Byrne, TX,Texas Health Resources,Sexual Assault Nurse Examiners (SANE) Program,"$269,186 ",Van Duyne,
Department of Justice,OJP Byrne, TX,Dallas Ft. Worth Airport,Autonomous Mobile Robotics & Advanced-Xray Solutions,"$1,100,000 ",Van Duyne,
Department of Justice,OJP Byrne, CA,City of San Diego,Drone Spotter Detection System,"$275,000 ",Vargas,
Department of Justice,OJP Byrne, TX,Cook Children’s Medical Center,Cook Children’s Child Advocacy and Resource Evaluation (C.A.R.E.) Team,"$1,031,000 ",Veasey,
Department of Justice,OJP Byrne, TX,JPS Health Network,JPS Forensic Nursing Services Expansion,"$1,000,000 ",Veasey,
Department of Justice,OJP Byrne, TX,United Way of Tarrant County,One Second Collaborative,"$1,031,000 ",Veasey,
Department of Justice,OJP Byrne, NY,Bangladeshi American Community Development and Youth Service,Workforce Development for Low-Income and Justice-Involved Residents,"$250,000 ",Velazquez,
Department of Justice,OJP Byrne, NY,"Comunilife, Inc.",Adolescent Suicide Prevention Activities,"$200,000 ",Velazquez,
Department of Justice,OJP Byrne, NY,Ozone Park Residents Block AssociationOzpkrba Inc,Block Watchers Program & Safety Initiative,"$345,000 ",Velazquez,
Department of Justice,OJP Byrne, CA,City of Gardena,Gardena Juvenile Justice & Intervention Project (GJJIP),"$550,000 ",Waters,
Department of Justice,OJP Byrne, CA,Los Angeles International Airport Police Department (LAXPD),"LAXPD Vehicle Fleet, Upgrades, & Equipment","$963,000 ",Waters,
Department of Justice,OJP Byrne, FL,Orange County Sheriff Office,Central Florida Training Equipment Orange County Sheriff,"$342,961 ",Webster,
Department of Justice,OJP Byrne, CA,City of Lancaster Police Department,Advanced Equipment for Lancaster Police Department,"$1,023,000 ",Whitesides,
Department of Justice,OJP Byrne, CA,"Los Angeles County Sheriff’s Department, North Patrol Division",Mobile Command Center Los Angeles Sheriff’s Department 27,"$1,000,000 ",Whitesides,
Department of Justice,OJP Byrne, CA,Santa Clarita Valley Boys & Girls Club,Santa Clarita Valley and Antelope Valley Boys & Girls Club Opioid & Substance Use Prevention Initiative,"$1,031,000 ",Whitesides,
Department of Justice,OJP Byrne, GA,Center for Employment Opportunities,Job Training & Career Pathways for Georgia’s Returning Citizens,"$300,000 ",Williams (GA),
Department of Justice,OJP Byrne, GA,Clark Atlanta University,Clark Atlanta University Security Project,"$250,000 ",Williams (GA),
Department of Justice,OJP Byrne, GA,"Communities In Schools of Atlanta, Inc.",Violence Prevention and Mental Health Programming in Metro Atlanta Schools,"$401,000 ",Williams (GA),
Department of Justice,OJP Byrne, GA,Georgia Center for Child Advocacy,Justice & Healing for the Fighting Fifth,"$850,000 ",Williams (GA),
Department of Justice,OJP Byrne, GA,Morris Brown College,Scaling Security & Safety at Morris Brown College,"$700,000 ",Williams (GA),
Department of Justice,OJP Byrne, GA,Spelman College,SAFE–SPEL: Spelman College Public Safety Department’s Advanced Framework for Ensuring Safety and Security on Campus,"$437,000 ",Williams (GA),
Department of Justice,OJP Byrne, FL,Broward County Public Schools,Broward County Public Schools Youth Empowerment and Safety Initiative (YES Initiative),"$1,031,000 ",Wilson (FL),
Department of Justice,OJP Byrne, FL,City of Miramar,Empowering Miramar Youth: Crime Prevention Through Community Engagement,"$1,031,000 ",Wilson (FL),
Department of Justice,OJP Byrne, FL,City of Opa-Locka,Empowering Opa-Locka Youth: Crime Prevention Through Community Engagement,"$1,031,000 ",Wilson (FL),
Department of Justice,OJP Byrne, FL,Duval County Public Schools,Duval County Public Schools Youth Empowerment and Safety Initiative (YES Initiative),"$1,031,000 ",Wilson (FL),
Department of Justice,OJP Byrne,FL,Miami-Dade County Public Schools,Miami-Dade County Public Schools Youth Empowerment and Safety Initiative (YES Initiative),"$1,039,000 ",Wilson (FL),
Department of Justice,OJP Byrne, MT,Gallatin County Sheriff’s Office,Gallatin County Sheriff’s Office Rapid DNA Capabilities and Patrol Vehicles,"$906,660 ",Zinke,
Department of Justice,OJP Byrne, MT,Mineral County,Five-County Law Enforcement Resilience Project,"$2,889,500 ",Zinke,
Department of Justice,COPS Tech, CA,City of Rialto,Rialto Police Station’s Technology and Safety Equipment Project,"$1,031,000 ",Aguilar,
Department of Justice,COPS Tech, CA,City of San Bernardino,San Bernardino Mobile Crime Prevention Program,"$1,031,000 ",Aguilar,
Department of Justice,COPS Tech, MO,City of Peculiar,Peculiar Police Department Radios,"$120,000 ",Alford,
Department of Justice,COPS Tech, RI,Bristol Rhode Island Police Department,Bristol PD Interoperable Encrypted Radio Project,"$966,000 ",Amo,
Department of Justice,COPS Tech, RI,Smithfield Police Department,Essential Technology and Equipment for Smithfield Police Department,"$785,000 ",Amo,
Department of Justice,COPS Tech, RI,Town of North Smithfield,North Smithfield Police Department Improvements,"$500,000 ",Amo,
Department of Justice,COPS Tech, NV,"Douglas County, Nevada, Sheriff’s Office",Douglas County Sheriff’s Office Mobile Command Center,"$400,000 ",Amodei,
Department of Justice,COPS Tech, NV,City of Fallon,Modernizing the Fallon Police Department Dispatch and Emergency Response Communication Network and Records Management System,"$1,000,000 ",Amodei,
Department of Justice,COPS Tech, NV,"City of Reno, Reno Police Department",Reno Police Department’s Real Time Information Center Project,"$1,200,000 ",Amodei,
Department of Justice,COPS Tech, NV,Washoe County,Northern Nevada Mobile Intelligence Response Vehicle,"$3,000,000 ",Amodei,
Department of Justice,COPS Tech, AZ,City of Phoenix,Phoenix Real Time Crime Center (RTCC),"$1,031,000 ",Ansari,
Department of Justice,COPS Tech, NE,Douglas County Sheriff’s Office,Preventing Criminal Activity and Enhancing Community Safety,"$597,658 ",Bacon,
Department of Justice,COPS Tech, MI,City of East Lansing,East Lansing Police Department Public Safety & Security Enhancements Initiative,"$472,000 ",Barrett,
Department of Justice,COPS Tech, MO,City of Vinita Park,Vinita Park & 8 Municipalities Police Equipment and Vehicle Upgrades,"$324,000 ",Bell,
Department of Justice,COPS Tech,CA,Sacramento County Sheriff’s Office,Sacramento County Sheriff’s Office ICAC Technology Project,"$800,000 ",Bera,
Department of Justice,COPS Tech, MI,"County of Houghton, Michigan",Houghton County Patrol Vehicles Request,"$177,000 ",Bergman,
Department of Justice,COPS Tech, VA,"City of Alexandria, VA",Radio System Interoperability Upgrade,"$650,000 ",Beyer,
Department of Justice,COPS Tech, VA,"City of Alexandria, VA",Violence and Crime Prevention Technology within the City of Alexandria,"$670,000 ",Beyer,
Department of Justice,COPS Tech, FL,Citrus County Sheriff’s Office,Citrus Sheriff Enhanced Radio Interoperability,"$3,000,000 ",Bilirakis,
Department of Justice,COPS Tech, FL,District School Board of Pasco County,Weapons Detection Enhancement and Security Updates for Pasco County Schools,"$1,750,000 ",Bilirakis,
Department of Justice,COPS Tech, GA,"City of Newton, GA",City of Newton Public Safety,"$120,000 ",Bishop (GA),
Department of Justice,COPS Tech, GA,Columbus State University,Columbus State University Public Safety Investment,"$313,000 ",Bishop (GA),
Department of Justice,COPS Tech, GA,Early County Board of Commissioners,Regional E911 Equipment Upgrade,"$629,000 ",Bishop (GA),
Department of Justice,COPS Tech, OR,Clatsop County,Clatsop County Public Safety Equipment & 911 Operations Initiative,"$1,031,000 ",Bonamici,
Department of Justice,COPS Tech, IL,Clinton County Government,Countywide Emergency Radio and Communication System,"$2,100,000 ",Bost,
Department of Justice,COPS Tech, PA,Scranton Police Department,Scranton Police Department Equipment and Technology Upgrades,"$500,000 ",Bresnahan,
Department of Justice,COPS Tech, OH,Cuyahoga County Executive’s Office,Internet Crimes Against Children Taskforce Technology,"$500,000 ",Brown,
Department of Justice,COPS Tech, IL,City of Gillespie,Gillespie Rural Policing Technology Equipment,"$200,000 ",Budzinski,
Department of Justice,COPS Tech, CA,County of San Luis Obispo,San Luis Obispo County Jail Security System Project,"$1,031,000 ",Carbajal,
Department of Justice,COPS Tech, OH,Ohio Jewish Communities on behalf of JewishColumbus,Community Security Technology Funding Project,"$300,000 ",Carey,
Department of Justice,COPS Tech, IN,Indiana State Police,Indiana State Police Internet Crimes Against Children (ICAC) Task Force Program Equipment,"$675,000 ",Carson,
